{
  "schema_version": "pa_feitian_decision_intent_v1",
  "generated_at_utc": "2026-07-07T00:00:00Z",
  "source_commit": "cccccccccccccccccccccccccccccccccccccccc",
  "provenance": {
    "role": "manifest_referenced_decision_intent_sidecar",
    "source_manifest_path": "src/tests/fixtures/pa_feitian_run_manifest_with_decision_intent_v1.json",
    "source_manifest_schema_version": "pa_feitian_run_manifest_v1",
    "source_manifest_generated_at_utc": "2026-07-07T00:00:00Z",
    "snapshot_artifact_path": "src/tests/fixtures/pa_feitian_snapshot_v1.json",
    "snapshot_artifact_sha256": "sha256:e112b3bac01cfa8147a7c043c6897e13525bfbfbd913384db07638603353fff6",
    "snapshot_schema_version": "pa_feitian_snapshot_v1",
    "producer": "engine.pa_feitian.decision_intent_adapter.v0_2",
    "notes": [
      "focused v0.2 strategy adapter sidecar; snapshot v0/v1 semantics unchanged",
      "execution_allowed remains false unless explicit premium stop, confirmation, and liquidity gates pass at decision time"
    ]
  },
  "intents": [
    {
      "signal_id": "paft_scorecard_0001_kq_m_shfe_au_20260628000000",
      "instrument": "SHFE.au",
      "contract": "kq_m_shfe_au",
      "interval": "1d",
      "decision_ts_utc": "2026-06-28T00:00:00Z",
      "decision_state": "armed_watch",
      "execution_allowed": false,
      "product_direction_tier": "aligned_trade_candidate",
      "premium_stop": {
        "status": "unclear",
        "source": "recent_36bar_low",
        "entry_premium": 18.5,
        "stop_premium": 17.9,
        "stop_distance_pct": 3.243243243243251,
        "soft_gate_min_pct": 4.0,
        "soft_gate_max_pct": 12.0,
        "asof_ts_utc": "2026-06-28T00:00:00Z",
        "evidence_ref": "scorecard_record:1"
      },
      "confirmation": {
        "status": "pending",
        "source": "premium_macd",
        "confirmed_at_utc": null,
        "evidence_ref": "scorecard_record:1"
      },
      "liquidity": {
        "status": "adequate",
        "quote_count": 12,
        "last_quote_age_seconds": 30,
        "recovery_required": false,
        "evidence_ref": "scorecard_record:1"
      },
      "reason_codes": [
        "STOP_DISTANCE_OUTSIDE_SOFT_GATE",
        "STOP_CLEAR_DOWNGRADED",
        "PREMIUM_CONFIRMATION_PENDING",
        "LIQUIDITY_OK",
        "PRODUCT_DIRECTION_ALIGNED",
        "SOURCE_STATUS_DATA_BLOCKED",
        "ARMED_WATCH_READINESS_PENDING"
      ],
      "no_lookahead_inputs": [
        {
          "id": "scorecard_record:1",
          "kind": "scorecard_record",
          "source": "score_today_json",
          "record_index": 1,
          "asof_ts_utc": "2026-06-28T00:00:00Z",
          "digest": "sha256:27dced3aa613b6b2555f45708b553f9e8be342061ef4fc75dd6681b4163592b1"
        },
        {
          "id": "snapshot_signal:paft_scorecard_0001_kq_m_shfe_au_20260628000000",
          "kind": "snapshot_signal",
          "source": "pa_feitian_snapshot_v1.decision_fields",
          "record_index": 1,
          "asof_ts_utc": "2026-06-28T00:00:00Z",
          "digest": "sha256:206b1125f31f220dac3337d38a49546b6d8dcfda9face85031f00dc966d2a3c0"
        }
      ]
    },
    {
      "signal_id": "paft_scorecard_0002_kq_m_shfe_au_20260629000000",
      "instrument": "SHFE.au",
      "contract": "kq_m_shfe_au",
      "interval": "1d",
      "decision_ts_utc": "2026-06-29T00:00:00Z",
      "decision_state": "trade_ready",
      "execution_allowed": true,
      "product_direction_tier": "aligned_trade_candidate",
      "premium_stop": {
        "status": "clear",
        "source": "swing_low_premium",
        "entry_premium": 12.2,
        "stop_premium": 11.2,
        "stop_distance_pct": 8.196721311475411,
        "soft_gate_min_pct": 4.0,
        "soft_gate_max_pct": 12.0,
        "asof_ts_utc": "2026-06-29T00:00:00Z",
        "evidence_ref": "scorecard_record:2"
      },
      "confirmation": {
        "status": "confirmed",
        "source": "premium_macd",
        "confirmed_at_utc": "2026-06-29T00:00:00Z",
        "evidence_ref": "scorecard_record:2"
      },
      "liquidity": {
        "status": "adequate",
        "quote_count": 18,
        "last_quote_age_seconds": 15,
        "recovery_required": false,
        "evidence_ref": "scorecard_record:2"
      },
      "reason_codes": [
        "PREMIUM_STOP_CLEAR",
        "PREMIUM_CONFIRMATION_CONFIRMED",
        "LIQUIDITY_OK",
        "PRODUCT_DIRECTION_ALIGNED",
        "TRADE_READY_PREMIUM_CONFIRMED"
      ],
      "no_lookahead_inputs": [
        {
          "id": "scorecard_record:2",
          "kind": "scorecard_record",
          "source": "score_today_json",
          "record_index": 2,
          "asof_ts_utc": "2026-06-29T00:00:00Z",
          "digest": "sha256:30d70f3ca92533885529ec662b92395cbbf62444da34b832d4749b3cee3a8fcc"
        },
        {
          "id": "snapshot_signal:paft_scorecard_0002_kq_m_shfe_au_20260629000000",
          "kind": "snapshot_signal",
          "source": "pa_feitian_snapshot_v1.decision_fields",
          "record_index": 2,
          "asof_ts_utc": "2026-06-29T00:00:00Z",
          "digest": "sha256:00d8f28723fda5995a0e8214f404982f8186980683df2ae5bf4014ba7f3de74e"
        }
      ]
    },
    {
      "signal_id": "paft_scorecard_0003_kq_m_shfe_au_20260630000000",
      "instrument": "SHFE.au",
      "contract": "kq_m_shfe_au",
      "interval": "1d",
      "decision_ts_utc": "2026-06-30T00:00:00Z",
      "decision_state": "watch",
      "execution_allowed": false,
      "product_direction_tier": "aligned_trade_candidate",
      "premium_stop": {
        "status": "blocked",
        "source": "unavailable",
        "entry_premium": 10.4,
        "stop_premium": null,
        "stop_distance_pct": null,
        "soft_gate_min_pct": 4.0,
        "soft_gate_max_pct": 12.0,
        "asof_ts_utc": "2026-06-30T00:00:00Z",
        "evidence_ref": "scorecard_record:3"
      },
      "confirmation": {
        "status": "pending",
        "source": "unavailable",
        "confirmed_at_utc": null,
        "evidence_ref": "scorecard_record:3"
      },
      "liquidity": {
        "status": "unknown",
        "quote_count": null,
        "last_quote_age_seconds": null,
        "recovery_required": true,
        "evidence_ref": "scorecard_record:3"
      },
      "reason_codes": [
        "PREMIUM_STOP_UNAVAILABLE",
        "PREMIUM_CONFIRMATION_PENDING",
        "LIQ_RECOVERY_REQUIRED",
        "PRODUCT_DIRECTION_ALIGNED",
        "MODEL_DOMINATED_PREMIUM"
      ],
      "no_lookahead_inputs": [
        {
          "id": "scorecard_record:3",
          "kind": "scorecard_record",
          "source": "score_today_json",
          "record_index": 3,
          "asof_ts_utc": "2026-06-30T00:00:00Z",
          "digest": "sha256:56ae38fb2e247d40219aae3ff6d5e00b28f0bed2f994400f582c6a007ca09c0e"
        },
        {
          "id": "snapshot_signal:paft_scorecard_0003_kq_m_shfe_au_20260630000000",
          "kind": "snapshot_signal",
          "source": "pa_feitian_snapshot_v1.decision_fields",
          "record_index": 3,
          "asof_ts_utc": "2026-06-30T00:00:00Z",
          "digest": "sha256:d96c1d4f811393cd4b1ab91cde3a4c01e5c5023641b2180fbf0737a9628ffeb4"
        }
      ]
    }
  ],
  "warnings": [
    "decision intent sidecar is readiness metadata only; it does not execute orders",
    "missing premium stop, confirmation, or liquidity inputs are downgraded instead of being inferred from outcomes"
  ]
}
